Job Title,Company Name,Location,Skills,Years of Experience,Education,Job Type,Salary
Lead Data Scientist,bioMérieux,San Jose; CA,"Matplotlib, Software development, R, Analytics, Data Mining, Project Leadership, Research, Data Analysis, Python, Machine Learning Algorithms, Computer Science, Statistics, Statistical Analysis, Tableau, Seaborn, Leadership, Power BI, Machine Learning",60,Doctorate; Master,Not specified,157;040 - 203;900 a year
Sr Data Scientist - Personalization and Recommendations (Applied ML; Deep Learning)(Remote Or Hybrid),Target,Remote in Minneapolis; MN 55403,"AI, Spark, Deep Learning, Hadoop, SQL, Python, Scala, Agile, Statistics, Machine Learning",3,Doctorate,Full-time,93;800 - 202;600 a year
Data Scientist,US National Institutes of Health,Remote,"AI, R, Data Mining, Big Data, Data Visualization, Python, Computer Science, Statistics, MATLAB, Tableau, Machine Learning",Not specified,Bachelor,Full-time,139;395 - 181;216 a year
Data Scientist,CVS Health,Remote in Hartford; CT,"Analytics, Data Mining, SQL, Data Analysis, SAS, Natural Language Processing, Computer Science, Statistics, Statistical Software, Tableau, Data Warehouse, Machine Learning",Not specified,Master,Full-time,80;870 - 150;000 a year
Sr. Data Scientist,CVS Health,New York; NY,"Azure, NoSQL, Python, Computer Science, Big Data, Natural Language Processing, Statistical Software, Statistical Analysis, Research, R, Analytics, Java, Tableau, Data Mining, AWS, Hadoop, SQL, MySQL, Machine Learning",Not specified,Master,Full-time,108;306 - 200;000 a year
Data Scientist II,Honeywell,Hybrid work in Kansas City; MO 64147,"Spark, Scripting, Deep Learning, R, Analytics, Software development, Hadoop, SQL, Python, Statistics, Tableau, Machine Learning",Not specified,Master,Not specified,Not specified
Senior Data Scientist; Research,Google,Reston; VA  (Sunset Hills area),"Analytics, R, SQL, Python, Statistics, Statistical Analysis, Research",8,Doctorate; Master,Full-time,Not specified
Senior Data Scientist,Petco,San Antonio; TX 78245,,Not specified,Not Specified,Full-time,119;000 - 134;000 a year
Data Scientist,USDM Life Sciences,Thousand Oaks; CA,"MATLAB, Data Analysis, Python, Analytics",21,Doctorate; Master,Full-time,40 - 50 an hour
Analyst 1; Statistical Researcher,Salt Lake Community College,Salt Lake City; UT 84123,"R, Analytics, Data Analytics, Data Mining, Data Visualization, Statistics, Statistical Analysis, Research, Machine Learning",Not specified,Bachelor; Master,Full-time,62;974 a year
Jr Statistician - Urology,UCLA Health,Los Angeles; CA 90095,"R, SAS, Computer Science, Statistical Software, Statistical Analysis, Statistics, Research",2,Bachelor,Full-time,Not specified
Sr. Data Analyst,WebMD,Newark; NJ 07102  (Central Business District area),"Sales, Excel, Business Analysis, SQL, Marketing",2,Not Specified,Full-time,Not specified
Data Scientist,Lockton; Inc.,Dallas; TX,"Software development, R, Analytics, Excel, Data Analytics, Data Mining, Forecasting, SQL, Big Data, Python, SAS, Agile, Statistics, Computer Science, Data Warehouse, Research, APIs, Machine Learning",2,Bachelor; Master,Full-time,Not specified
Senior Data Scientist,Aurora Innovation,Mountain View; CA,"AWS, Data Engineering, Forecasting, SQL, NumPy, Python, Computer Science, Statistics, Research, PyTorch, Big Data",4,Doctorate,Not specified,168;000 - 252;000 a year
Staff Data Scientist 1,Applied Research Associates; Inc,Bentonville; AR 72712,"Data Mining, Research, Kubernetes",10,Bachelor; Master,Not specified,Not specified
Data Scientist II,Black Eagle Defense,Annapolis Junction; MD,"Data Mining, Hypothesis testing, Data Structures, Python, Computer Science, Statistics, Statistical Analysis, Research, Machine Learning",5,Bachelor,Full-time,Not specified
Sr. Data Scientist,CVS Health,Remote in New York; NY,"Azure, R, Analytics, Data Mining, AWS, Hadoop, Big Data, SQL, Natural Language Processing, Python, Computer Science, Statistical Software, Statistics, Statistical Analysis, Tableau, Research, Machine Learning",Not specified,Master,Full-time,108;306 - 200;000 a year
Data Scientist II,Honeywell,Hybrid work in Kansas City; MO 64147,"Leadership, Software development, Analytics, Machine Learning",Not specified,Master,Not specified,Not specified
Lead Data Scientist,CVS Health,New York; NY,"Spark, R, Analytics, AWS, SQL, Jira, Docker, Python, Statistics, Statistical Analysis, Tableau, Research, Machine Learning",Not specified,Master,Full-time,132;250 - 260;000 a year
Data Scientist,US National Institutes of Health,Montgomery County; MD,"AI, Deep Learning, R, Data Mining, Data Visualization, Python, Computer Science, Reinforcement Learning, Statistics, MATLAB, Leadership, Tableau, Machine Learning",Not specified,Bachelor,Full-time,117;962 - 153;354 a year
Statistician,US Cybersecurity and Infrastructure Security...,Arlington; VA 22209  (Radnor-Ft Myer Heights area),"Research, Statistics",5,Not Specified,Full-time,139;395 - 181;216 a year
Senior Data Scientist / Applied Statistician,LaunchDarkly,Oakland; CA,"Go, Data Engineering, Scala, Statistics, Machine Learning",Not specified,Not Specified,Not specified,Not specified
Statistician - Direct Hire,US Department of Transportation - Agency Wide,Salt Lake City; UT,"Forecasting, Data Analysis, Statistical Software, Statistical Analysis, Statistics, Research",3,Doctorate,Part-time,72;553 - 134;435 a year
Sr.; Data Analyst,Parkland Health and Hospital System,Dallas; TX 75201,"Analytics, Excel, Data Analysis, Statistical Analysis, Research",125,Bachelor; Master,Not specified,Not specified
Manager - Data Analytics & Statistician,Amex,Hybrid work in New York; NY,"Analytics, Excel, Data Analytics, Project Management, Marketing, Tableau, Leadership",7,Not Specified,Not specified,80;000 - 155;000 a year
Statistician I,University of Nebraska Medical Center,Hybrid work in Omaha; NE,"R, SQL, Data Analysis, Python, SAS, Statistical Software, Statistics, Statistical Analysis, Research",Not specified,Master,Full-time,60;500 - 90;800 a year
SR Data Scientist,Vass,Remote,"AI, Spark, Azure, Python, Git",1,Not Specified,Not specified,Not specified
Data Scientist,AstraZeneca,Mount Vernon; IN 47620,"AI, Github, Software development, Analytics, Data Analytics, Data Engineering, SQL, Jira, Python, Computer Science, Agile, Power BI, Snowflake, Machine Learning",3,Bachelor,Full-time,Not specified
Data Scientist,Serco North America,Remote in Rock Island; IL 61201,"Scripting, Azure, R, Analytics, Pandas, Data Analytics, Forecasting, SQL, NumPy, Data Visualization, Python, SAS, Statistics, Statistical Analysis, Tableau, Research, Leadership, Machine Learning",10,Bachelor; Master,Full-time,Not specified
Senior Data Scientist - HTS - Fintech Ancillaries,Hopper,New York; NY,"SQL, Data Visualization, Python, Machine Learning Algorithms, Leadership, Machine Learning",Not specified,Not Specified,Full-time,110;000 - 300;000 a year
Senior Data Scientist; Growth,Upstart Network; Inc.,Remote,"AI, R, A/B Testing, SQL, Hypothesis testing, Data Analysis, Python, Marketing, Statistics, Statistical Analysis, Research, Machine Learning",2,Bachelor; Doctorate,Not specified,149;800 - 207;000 a year
TikTok Shop - Data Scientist,TikTok,Seattle; WA,"R, Analytics, SQL, Python, Computer Science, Statistics, Machine Learning",Not specified,Bachelor; Doctorate,Not specified,108;000 - 168;000 a year
Sr Data Scientist - Demand Forecasting,Target,Minneapolis; MN 55445,"AI, Software development, R, Forecasting, CI/CD, Java, Data Structures, Data Analysis, Python, Scala, Machine Learning Algorithms, Statistics, Marketing, Machine Learning",Not specified,Not Specified,Full-time,93;800 - 168;800 a year
Senior Data Scientist,Capital One,McLean; VA,"Spark, Deep Learning, R, Analytics, Data Analytics, AWS, Big Data, SQL, Cloud Computing, Python, Scala, Data Analysis, Research, Machine Learning",2,Bachelor; Doctorate; Master,Full-time,Not specified
Data Scientist,Micron,Manassas; VA,"AI, R, Analytics, Data Analytics, Data Engineering, Big Data, Data Visualization, Computer Science, Statistics, Machine Learning",Not specified,Master,Not specified,Not specified
Data Scientist II,Honeywell,Hybrid work in Kansas City; MO 64147,"Spark, Scripting, Deep Learning, R, Analytics, Software development, Hadoop, SQL, Python, Statistics, Tableau, Machine Learning",Not specified,Master,Not specified,Not specified
Data Scientist (Data Scientist 1) 19093,HII,Alexandria; VA,"AI, Software development, Data Mining, Big Data, Project Management, Agile, Machine Learning",4,Bachelor,Full-time,Not specified
Data Scientist,Booz Allen,Arlington; VA,"R, Analytics, Data Analytics, Data Mining, SQL, Java, Data Visualization, Data Analysis, Python, Statistics, Statistical Analysis, Tableau, Leadership, Power BI, Machine Learning",5,Bachelor; Master,Full-time,75;600 - 172;000 a year
Mathematical Statistician,US Drug Enforcement Administration,Arlington; VA,"Research, Statistics",5,Not Specified,Full-time,112;015 - 145;617 a year
Data Scientist; Alexa Customer Journeys,Amazon.com Services LLC - A57,Seattle; WA,"AI, Scripting, R, Data Engineering, SQL, Data Analysis, Python, SAS, Scala, Perl, Product Management, MATLAB, Marketing, Machine Learning",3,Bachelor,Full-time,111;600 a year
Applied Scientist Seller Growth ; International Seller Growth,Amazon.com Services LLC,Seattle; WA,"Deep Learning, Java, Python, Computer Science, Perl, Statistics, Research, Leadership, Machine Learning",2,Master,Full-time,115;100 a year
Space Data Scientist,Booz Allen,El Segundo; CA,"R, Forecasting, SQL, Hypothesis testing, Python, Scala, Marketing, Tableau, Leadership, Power BI",2,Bachelor; Master,Full-time,75;600 - 172;000 a year
Lead AI or ML Engineer - Remote,Optum,Remote in Minneapolis; MN 55401,"AI, Github, Deep Learning, R, Software development, Presentation Skills, Python, Computer Science, Statistics, Git, Machine Learning",5,Doctorate; Master,Full-time,104;700 - 190;400 a year
Data Analyst; Senior | HYBRID,Dignari,Washington; DC 20004  (Downtown area),"Analytics, Data Analytics, Data Structures, Data Analysis, Tableau, Leadership",Not specified,Not Specified,Full-time,Not specified
Researcher – Machine Learning – Microsoft Research,Microsoft,Redmond; WA 98052  (Overlake area),"Deep Learning, Natural Language Processing, Computer Science, Research, PyTorch, Machine Learning",Not specified,Doctorate,Full-time,117;200 - 229;200 a year
Senior Data Analyst (Remote),Patterson,Remote in Saint Paul; MN 55120,"Analytics, SQL, Data Analysis, Computer Science, Research, Leadership",5,Bachelor; Master,Full-time,Not specified
Senior Data Scientist; Customer Analytics,Atlassian,Remote in San Francisco; CA 94104,"Go, R, Analytics, SQL, Python, Statistics",Not specified,Doctorate; Master,Full-time,Not specified
Senior Data Analyst,Delaware North,Buffalo; NY 14202  (Central Business District area),"Sales, R, Analytics, Data Analytics, Data Engineering, SQL, Data Analysis, Python, SAS, Computer Science, Tableau, Research",100,Bachelor,Full-time,66;500 - 89;900 a year
Data Scientist - Expert - Moon 451-02,Integrated Intel Solutions,McLean; VA,"AI, Analytics, Pandas, Data Analytics, NumPy, Scikit-learn, Data Visualization, SciPy, Python, TensorFlow, Tableau, Leadership, PyTorch",Not specified,Not Specified,Not specified,Not specified
Staff Machine Learning Engineer,Labelbox,San Francisco Bay Area; CA,"AI, Deep Learning, Excel, Distributed Systems, Java, Natural Language Processing, Python, Machine Learning Algorithms, Computer Science, Research, Machine Learning",5,Bachelor,Not specified,215;000 - 250;000 a year
Staff ML Engineer,GE HEALTHCARE,Hybrid work in Seattle; WA 98108,"AI, Deep Learning, Computer Vision, Software development, Java, Python, Computer Science, Statistical Analysis, Leadership, Machine Learning",5,Doctorate; Master,Not specified,197;472 - 296;208 a year
Senior Data Analyst,NYC Office Of The Mayor,New York; NY,"Analytics, R, Excel, SQL, Data Visualization, Python, Tableau, Leadership, Power BI",Not specified,Not Specified,Full-time,76;000 - 86;000 a year
Data Science Principal Engineer,Verizon,Basking Ridge; NJ,"Spark, Analytics, SQL, Java, Python, Scala, Computer Science, Tableau, Big Data",Not specified,Bachelor; Master,Full-time,Not specified
Senior Healthcare Data Analyst,Mass General Brigham,Boston; MA 02114  (West End area),"Go, Azure, Analytics, Excel, SQL, Data Structures, Project Management, Data Visualization, Data Analysis, Data Warehouse, Statistics, Tableau, Research, Leadership, Snowflake",8,Bachelor,Full-time,Not specified
Data Scientist,INADEV,McLean; VA 22102,"Github, Azure, NoSQL, Python, Pandas, Presentation Skills, MongoDB, Docker, Natural Language Processing, Statistical Analysis, Linux, AI, Scripting, NumPy, Scikit-learn, APIs, Data Mining, AWS, SQL, Data Visualization, Statistics, Tableau, Machine Learning",5,Bachelor,Full-time,100;000 - 120;000 a year
Deep Learning Architect; GenAI Innovation Center,Amazon.com Services LLC,Santa Clara; CA 94085,"AI, Sales, Deep Learning, R, AWS, Java, Cloud Computing, Python, Computer Science, Marketing, Statistics, Research, Machine Learning",Not specified,Bachelor; Doctorate; Master,Full-time,105;100 a year
Senior Manager Data Scientist,Capital One,McLean; VA,"Spark, Deep Learning, R, Analytics, Data Analytics, AWS, Big Data, Cloud Computing, Python, Scala, Data Analysis, Research, Machine Learning",7,Bachelor; Doctorate; Master,Full-time,Not specified
Sr. Contract Data Analyst,Amyx; Inc.,Falls Church; VA 22044,"Accounting, Marketing, Excel",5,Bachelor,Full-time,Not specified
Data Scientist- TikTok Ads; Privacy,TikTok,San Jose; CA 95110  (Downtown area),"R, Analytics, Data Mining, Data Engineering, SQL, Quantitative analysis, Python, Computer Science, Marketing, Statistics, Research",Not specified,Not Specified,Not specified,145;000 - 281;000 a year
Data Science Research Specialist,Accenture,New York; NY,"Azure, Analytics, Google Cloud, Data Analytics, Team Management, SQL, Python, Statistics, Research, Leadership, Data lake, Machine Learning",3,Master,Full-time,Not specified
Data Scientist II,ManTech,Washington; DC 20528  (Downtown area),Data Analysis,Not specified,Bachelor,Full-time,Not specified
Data Innovation Expert,PHASTAR,Remote,"AI, Data Analysis, Machine Learning, Statistical Analysis, Research, Big Data",Not specified,Doctorate,Part-time,Not specified
AI/ML - Data Engineer; ML Innovation,Apple,Seattle; WA,"Spark, Analytics, NoSQL, A/B Testing, Distributed Systems, SQL, Java, Kafka, Scala, Python, Computer Science, Kubernetes, Machine Learning",3,Not Specified,Full-time,131;500 - 243;300 a year
Product Architect; Machine Learning,IQVIA,Durham; NC 27703,"AI, Analytics, Python, Machine Learning, Research, Big Data",Not specified,Not Specified,Full-time,Not specified
Data Science & Analytics Manager,Piper Sandler,Minneapolis; MN,"Analytics, Data Analysis, Marketing, Financial Services, Leadership, Machine Learning",Not specified,Not Specified,Full-time,Not specified
Decision Scientist,Meta,Menlo Park; CA 94025,"Scripting, R, Analytics, Pandas, Data Mining, Hadoop, NumPy, SQL, Quantitative analysis, Data Visualization, Data Analysis, Python, Natural Language Processing, Computer Science, Statistics, Marketing, Research, Machine Learning",5,Bachelor; Doctorate; Master,Not specified,133;000 - 185;000 a year
Data Scientist,Johnsonville,Sheboygan Falls; WI,"R, Analytics, SQL, Data Visualization, Data Analysis, Python, Computer Science, Statistics, Machine learning frameworks, Research, Leadership, Machine Learning",5,Bachelor,Full-time,Not specified
Data Scientist,Generac Power Systems,Waukesha; WI 53188,"Go, R, Analytics, Excel, Data Analytics, Data Mining, SQL, Java, Data Visualization, Cloud Computing, Python, SAS, Data Analysis, Perl, Statistical Analysis, Tableau, Computer Science, Machine Learning",Not specified,Not Specified,Full-time,Not specified
Inventory Management Data Scientist,Clark Associates,Remote in Lancaster; PA 17602,"R, Excel, Forecasting, SQL, Python, Statistics, MATLAB, Research, Power BI, Machine Learning",4,Bachelor; Master,Not specified,90;000 - 130;000 a year
Data Scientist,Carrier,Atlanta; GA 30339,"Azure, Python, Computer Science, Matplotlib, Pandas, Data Analysis, Statistical Analysis, PyTorch, AI, R, NumPy, Scikit-learn, Hypothesis testing, Java, TensorFlow, AWS, SQL, Data Visualization, Statistics, Tableau, Machine Learning",3,Bachelor,Full-time,Not specified
Data Scientist (All Levels),Noblis,McLean; VA,"Analytics, Data Analytics, Data Mining, MongoDB, SQL, Java, Scikit-learn, Docker, Python, Agile, TensorFlow, Kubernetes, MySQL, PyTorch, Git, Machine Learning",14,Bachelor; Doctorate; Master,Full-time,70;800 - 353;500 a year
Research Scientist; Machine Learning and Eye Tracking,Meta,Redmond; WA,"Computer Vision, R, Python, Computer Science, Statistical Analysis, Research, PyTorch, Machine Learning",5,Bachelor; Doctorate,Not specified,177;000 - 251;000 a year
Data Scientist (Rating & Underwriting Modeling),State Farm,Hybrid work in Bloomington; IL 61701,"R, Analytics, AWS, SQL, Python, SAS, Marketing, Statistics, Linux, Financial Services, Research, Leadership",Not specified,Master,Full-time,Not specified
User Insights Data Scientist - USDS,TikTok,Hybrid work in Los Angeles; CA,"Analytics, A/B Testing, SQL, Data Visualization, Data Analysis, Python, Statistics, Tableau, Machine Learning",2,Bachelor; Master,Not specified,108;300 - 168;800 a year
Data Scientist; CG-1560-13; Term Appointment NTE 2 years,US Federal Deposit Insurance Corporation,Salt Lake City; UT,"AI, R, Analytics, XML, JSON, SQL, Java, Data Analysis, Python, SAS, Computer Science, Statistics, Tableau, Research, Power BI, Machine Learning",Not specified,Not Specified,Full-time,113;750 - 240;993 a year
Data Scientist,KeyLogic Systems,Washington; DC,"AI, Spark, Deep Learning, Analytics, Data Analytics, Computer Science, TensorFlow, Leadership, PyTorch, Machine Learning",4,Bachelor; Doctorate; Master,Not specified,Not specified
Sr Forecasting & Modeling Analyst,NiSource,Columbus; OH 43215  (Downtown area),"Scripting, R, Analytics, Excel, Forecasting, SQL, Data Visualization, Python, Computer Science, Statistics, Tableau, Data lake, Data Warehouse",3,Bachelor,Full-time,77;400 - 116;200 a year
Machine Learning Engineer; Search Ads - USDS,TikTok,Hybrid work in Mountain View; CA 94041,"Go, Deep Learning, Data Analysis, Python, Natural Language Processing, Computer Science, Research, Machine Learning",Not specified,Not Specified,Not specified,119;000 - 168;150 a year
Applied Scientist; Conversational AI ModEling and Learning,Amazon.com Services LLC,Bellevue; WA,"AI, Spark, Deep Learning, R, Distributed Systems, Hadoop, NumPy, Scikit-learn, Java, SciPy, Natural Language Processing, Python, TensorFlow, Research, Leadership, PyTorch, APIs, Machine Learning",3,Doctorate; Master,Full-time,136;000 a year
Sr. Data Scientist; AWS Enterprise Support Customer Health Insights,Amazon Web Services; Inc.,Arlington; VA,"AI, Scripting, Sales, R, Business Analysis, AWS, SQL, Data Visualization, Cloud Computing, Python, SAS, Marketing, Statistics, MATLAB, Research, Leadership, Tableau, Machine Learning",5,Not Specified,Full-time,Not specified
Data Scientist,Provident Credit Union,Hybrid work in Redwood City; CA 94065,"R, Analytics, Excel, Banking, SQL, Scikit-learn, Data Visualization, Data Analysis, Python, Marketing, Accounting, Statistics, Financial Services, Tableau, Research, Machine Learning",3,Master,Full-time,99;000 - 128;000 a year
Postdoctoral Associate in Machine Learning and Computer Vision,MIT,Cambridge; MA 02139  (MIT area),"Research, Leadership, Computer Vision, Machine Learning",Not specified,Doctorate,Full-time,Not specified
Senior Underwriting Data Analyst,Church Mutual Insurance; S.I.,Hybrid work in Merrill; WI 54452,"Excel, SAS, Tableau, Research, Leadership",Not specified,Bachelor,Full-time,103;500 a year
Data Scientist,Orion,Hybrid work in West Sacramento; CA,"AI, Deep Learning, Data Visualization, Data Analysis, Python, Computer Science, Statistics, Statistical Analysis, Machine Learning",Not specified,Doctorate; Master,Not specified,Not specified
Deep Learning Architect; Generative AI Innovation Center,Amazon Web Services; Inc.,Santa Clara; CA 94085,"AI, Sales, Deep Learning, R, AWS, Java, Cloud Computing, Python, Computer Science, Marketing, Statistics, MATLAB, Research, Machine Learning",Not specified,Bachelor; Doctorate; Master,Full-time,105;100 a year
Health Data Researcher; Data & Insights,WALGREENS,Deerfield; IL 60015,,Not specified,Not Specified,Not specified,Not specified
